{
  "schema_version": "judge_input/2",
  "run_id": "run-example",
  "flow_id": "flow-example",
  "page_url": "https://example.test/tests",
  "site_requirements": "합성 예시: Increment는 Count를 1 증가시키고, 잘못된 이메일은 제출을 거부하며, Next 링크는 /tests/next로 이동한다. UI 제목이 보여야 한다.",
  "unplanned": [],
  "observations": {
    "snapshot-counter-before": {
      "observation": {
        "schema_version": "ai_input/1",
        "content_trust": "untrusted_page_data",
        "full_ref": {
          "snapshot_id": "snapshot-counter-before"
        },
        "page": {
          "url": "https://example.test/tests",
          "title": "Synthetic fixture",
          "snapshot_id": "snapshot-counter-before",
          "parent_snapshot_id": null,
          "action_id": null,
          "page_role": "html_page",
          "http_status": 200
        },
        "quality": {
          "status": "complete",
          "known_fields": [],
          "unknown_fields": [],
          "truncated": [],
          "unsupported": [],
          "collection_errors": []
        },
        "readiness": {
          "status": "ready_selector_found",
          "method": null,
          "selector": "body"
        },
        "controls": [
          {
            "key": "e:39df49d3f0935bf24625",
            "stability": "strong",
            "tag": "input",
            "type": "email",
            "role": "textbox",
            "label": "Email",
            "text": "Email",
            "form_key": null,
            "aria_invalid": null,
            "described_by": null,
            "visible": true,
            "hidden": false,
            "disabled": false,
            "checked": null,
            "readonly": false,
            "required": true,
            "value_present": false,
            "value_length": 0,
            "locator": {
              "strategy": "css",
              "selector": "#fixture-1"
            },
            "locator_verified": true
          },
          {
            "key": "e:477eb6ec4f161ef9c9e3",
            "stability": "strong",
            "tag": "button",
            "type": "button",
            "role": "button",
            "label": "Increment",
            "text": "Increment",
            "form_key": null,
            "aria_invalid": null,
            "described_by": null,
            "visible": true,
            "hidden": false,
            "disabled": false,
            "checked": null,
            "readonly": false,
            "required": false,
            "value_present": null,
            "value_length": null,
            "locator": {
              "strategy": "css",
              "selector": "#fixture-0"
            },
            "locator_verified": true
          },
          {
            "key": "e:5d7f48f1a6370798064e",
            "stability": "strong",
            "tag": "button",
            "type": "submit",
            "role": "button",
            "label": "Subscribe",
            "text": "Subscribe",
            "form_key": null,
            "aria_invalid": null,
            "described_by": null,
            "visible": true,
            "hidden": false,
            "disabled": false,
            "checked": null,
            "readonly": false,
            "required": false,
            "value_present": null,
            "value_length": null,
            "locator": {
              "strategy": "css",
              "selector": "#fixture-2"
            },
            "locator_verified": true
          },
          {
            "key": "e:b8f51632a8abdaecf007",
            "stability": "strong",
            "tag": "a",
            "type": null,
            "role": "link",
            "label": "Next",
            "text": "Next",
            "href": "https://example.test/tests/next",
            "form_key": null,
            "aria_invalid": null,
            "described_by": null,
            "visible": true,
            "hidden": false,
            "disabled": false,
            "checked": null,
            "readonly": false,
            "required": false,
            "value_present": null,
            "value_length": null,
            "locator": {
              "strategy": "css",
              "selector": "#fixture-3"
            },
            "locator_verified": true
          }
        ],
        "hidden_control_count": 0,
        "forms": [],
        "links": [
          {
            "url": "https://example.test/tests/next",
            "label": "Next",
            "area": null,
            "relation": null,
            "element_key": "e:b8f51632a8abdaecf007"
          }
        ],
        "errors": [],
        "untrusted_text": "Count: 0",
        "feature_candidates": [],
        "test_families": {
          "functional": {
            "availability": "available",
            "evidence_keys": [
              "e:477eb6ec4f161ef9c9e3",
              "e:5d7f48f1a6370798064e"
            ],
            "ai_tested": false
          },
          "input_validation": {
            "availability": "available",
            "evidence_keys": [
              "e:39df49d3f0935bf24625"
            ],
            "ai_tested": false
          },
          "routing": {
            "availability": "available",
            "evidence_keys": [
              "e:b8f51632a8abdaecf007"
            ],
            "ai_tested": false
          },
          "ui": {
            "availability": "available",
            "evidence_keys": [
              "e:39df49d3f0935bf24625",
              "e:477eb6ec4f161ef9c9e3",
              "e:5d7f48f1a6370798064e",
              "e:b8f51632a8abdaecf007"
            ],
            "ai_tested": false
          }
        },
        "warnings": [],
        "omitted": {
          "controls": 0,
          "links": 0,
          "errors": 0,
          "forms": 0,
          "text_chars": 0,
          "feature_candidates": 0,
          "missing_refs": 0
        },
        "source_truncated": false,
        "sizes": {
          "source_json_bytes": 2773,
          "ai_input_bytes": 3170,
          "budget_bytes": 12288
        }
      },
      "supplement": {
        "snapshot_id": "snapshot-counter-before",
        "untrusted_text": "Count: 0",
        "env": {
          "viewport": {
            "width": 1280,
            "height": 800
          }
        },
        "readiness": {
          "status": "ready_selector_found",
          "selector": "body"
        },
        "policy_blocks": []
      },
      "events": [],
      "resources": [],
      "navigation": {
        "kind": "document"
      },
      "redirects": []
    },
    "snapshot-counter-after": {
      "observation": {
        "schema_version": "ai_input/1",
        "content_trust": "untrusted_page_data",
        "full_ref": {
          "snapshot_id": "snapshot-counter-after"
        },
        "page": {
          "url": "https://example.test/tests",
          "title": "Synthetic fixture",
          "snapshot_id": "snapshot-counter-after",
          "parent_snapshot_id": null,
          "action_id": "action-counter",
          "page_role": "html_page",
          "http_status": 200
        },
        "quality": {
          "status": "complete",
          "known_fields": [],
          "unknown_fields": [],
          "truncated": [],
          "unsupported": [],
          "collection_errors": []
        },
        "readiness": {
          "status": "ready_selector_found",
          "method": null,
          "selector": "body"
        },
        "controls": [
          {
            "key": "e:39df49d3f0935bf24625",
            "stability": "strong",
            "tag": "input",
            "type": "email",
            "role": "textbox",
            "label": "Email",
            "text": "Email",
            "form_key": null,
            "aria_invalid": null,
            "described_by": null,
            "visible": true,
            "hidden": false,
            "disabled": false,
            "checked": null,
            "readonly": false,
            "required": true,
            "value_present": false,
            "value_length": 0,
            "locator": {
              "strategy": "css",
              "selector": "#fixture-1"
            },
            "locator_verified": true
          },
          {
            "key": "e:477eb6ec4f161ef9c9e3",
            "stability": "strong",
            "tag": "button",
            "type": "button",
            "role": "button",
            "label": "Increment",
            "text": "Increment",
            "form_key": null,
            "aria_invalid": null,
            "described_by": null,
            "visible": true,
            "hidden": false,
            "disabled": false,
            "checked": null,
            "readonly": false,
            "required": false,
            "value_present": null,
            "value_length": null,
            "locator": {
              "strategy": "css",
              "selector": "#fixture-0"
            },
            "locator_verified": true
          },
          {
            "key": "e:5d7f48f1a6370798064e",
            "stability": "strong",
            "tag": "button",
            "type": "submit",
            "role": "button",
            "label": "Subscribe",
            "text": "Subscribe",
            "form_key": null,
            "aria_invalid": null,
            "described_by": null,
            "visible": true,
            "hidden": false,
            "disabled": false,
            "checked": null,
            "readonly": false,
            "required": false,
            "value_present": null,
            "value_length": null,
            "locator": {
              "strategy": "css",
              "selector": "#fixture-2"
            },
            "locator_verified": true
          },
          {
            "key": "e:b8f51632a8abdaecf007",
            "stability": "strong",
            "tag": "a",
            "type": null,
            "role": "link",
            "label": "Next",
            "text": "Next",
            "href": "https://example.test/tests/next",